{
  "schema_version": "1.0.0",
  "kind": "env_step",
  "ts_utc": "2026-06-10T08:05:00Z",
  "run_id": "golden-b",
  "seq": 743,
  "payload": {
    "step": 23,
    "episode": 5,
    "dt_hours": 1.0,
    "sim_time_utc": "2026-04-01T00:00:00Z",
    "hour_of_day": 0,
    "minute_of_hour": 0,
    "wind_speed_mps": 7.1,
    "irradiance_wm2": 0.0,
    "temperature_c": 9.4,
    "load_mw": 72.5,
    "price_buy_yuan_per_mwh": 500.0,
    "price_sell_yuan_per_mwh": 470.0,
    "tariff_tier": "valley",
    "battery": {
      "soc": 0.5,
      "p_charge_mw": 0.0,
      "p_discharge_mw": 0.0,
      "p_max_charge_mw": 98.16,
      "p_max_discharge_mw": 98.16,
      "soc_violation_mwh": 0.0,
      "capacity_mwh": 294.5
    },
    "generation": {
      "gross_solar_mw": 0.0,
      "gross_wind_mw": 52.5
    },
    "flows": {
      "solar_to_load_mw": 0.0,
      "solar_to_bat_mw": 0.0,
      "solar_to_grid_mw": 0.0,
      "wind_to_load_mw": 52.5,
      "wind_to_bat_mw": 0.0,
      "wind_to_grid_mw": 0.0,
      "bat_to_load_mw": 0.0,
      "bat_to_grid_mw": 0.0,
      "grid_to_load_mw": 20.0,
      "grid_to_bat_mw": 0.0,
      "solar_curtailed_mw": 0.0,
      "wind_curtailed_mw": 0.0,
      "bat_curtailed_mw": 0.0,
      "load_unserved_mw": 0.0
    },
    "pcc": {
      "export_mw": 0.0,
      "import_mw": 20.0,
      "max_export_mw": 945.0,
      "max_import_mw": 400.0
    },
    "costs": {
      "c_energy_yuan": 10000.0,
      "c_import_yuan": 10000.0,
      "r_export_yuan": 0.0,
      "c_demand_charge_yuan": 3040000.0,
      "c_demand_shape_yuan": 5000.0,
      "c_degradation_yuan": 400.0,
      "c_curtail_yuan": 0.0,
      "c_voll_yuan": 0.0,
      "penalty_yuan": 0.0,
      "demand_rate_yuan_per_mw_month": 32000.0,
      "cost_total_real_yuan": 3050400.0,
      "cost_total_reward_basis_yuan": 20400.0
    },
    "cost_cum": {
      "c_energy_yuan_cum": 10000.0,
      "c_demand_charge_yuan_cum": 3040000.0,
      "c_demand_shape_yuan_cum": 5000.0,
      "c_degradation_yuan_cum": 400.0,
      "c_curtail_yuan_cum": 0.0,
      "c_voll_yuan_cum": 0.0,
      "penalty_yuan_cum": 0.0,
      "cost_total_real_yuan_cum": 3050400.0,
      "cost_total_reward_basis_yuan_cum": 20400.0
    },
    "month_peak_mw": 95.0,
    "reward": -0.204
  }
}
